{
  "id": "bac-math-2019-principale-ex2",
  "schema_version": "1.0",
  "year": 2019,
  "session": "principale",
  "section": { "code": "MATH", "name_fr": "Mathématiques" },
  "subject": { "code": "MATH", "name_fr": "Mathématiques" },
  "curriculum_era": { "code": "ERA_2016_2025", "relevance_weight": 1.0 },
  "chapter": { "code": "COMPLEXES", "name_fr": "Nombres complexes" },
  "concepts": ["forme_exponentielle", "racines_n_iemes", "module_argument"],
  "exercise_text": "Le plan complexe est rapporté à un repère orthonormé direct (O, u, v). On considère l'équation (E): z^3 = 8 d'inconnue z dans l'ensemble des nombres complexes.",
  "difficulty": "hard",
  "estimated_minutes": 30,
  "questions": [
    {
      "number": "1",
      "text": "Résoudre dans C l'équation (E) et donner les solutions sous forme exponentielle.",
      "points": 2.0,
      "concepts": ["racines_n_iemes", "forme_exponentielle"]
    },
    {
      "number": "2",
      "text": "On note A, B, C les points d'affixes les solutions de (E). Montrer que le triangle ABC est équilatéral.",
      "points": 1.5,
      "concepts": ["module_argument"]
    }
  ],
  "correction": {
    "is_official": true,
    "author_type": "official",
    "reliability": "high",
    "items": [
      {
        "question": "1",
        "text": "z^3 = 8 = 8 e^{i·0}. Les solutions sont z_k = 2 e^{i(2kπ/3)}, k ∈ {0,1,2}, soit z_0 = 2, z_1 = 2 e^{i2π/3}, z_2 = 2 e^{i4π/3}.",
        "steps": [
          "Écrire 8 sous forme exponentielle: 8 e^{i·0}",
          "Appliquer la formule des racines n-ièmes",
          "Énumérer les trois solutions pour k = 0, 1, 2"
        ]
      },
      {
        "question": "2",
        "text": "Les trois affixes ont même module 2 et des arguments espacés de 2π/3, donc A, B, C sont sur un cercle de centre O et régulièrement répartis: le triangle est équilatéral.",
        "steps": [
          "Constater l'égalité des modules (points sur un même cercle)",
          "Constater l'écart angulaire constant de 2π/3",
          "Conclure que le triangle est équilatéral"
        ]
      }
    ]
  },
  "rubric": [
    { "question": "1", "description": "Mise sous forme exponentielle de 8", "points": 0.5, "keywords": ["8 e^{i0}", "forme exponentielle"] },
    { "question": "1", "description": "Application correcte de la formule des racines n-ièmes", "points": 1.0, "keywords": ["2kπ/3", "racines", "e^{i"] },
    { "question": "1", "description": "Énumération des 3 solutions", "points": 0.5, "keywords": ["z_0", "z_1", "z_2"] },
    { "question": "2", "description": "Égalité des modules", "points": 0.5, "keywords": ["module", "cercle"] },
    { "question": "2", "description": "Conclusion équilatéral justifiée", "points": 1.0, "keywords": ["2π/3", "équilatéral"] }
  ],
  "common_mistakes": [
    { "description_fr": "Oublier le terme 2kπ et ne trouver qu'une seule solution", "frequency": "very_common", "correct_approach": "Une équation z^n = a admet exactement n solutions: parcourir k de 0 à n-1." },
    { "description_fr": "Erreur sur le module (prendre 8 au lieu de 2)", "frequency": "common", "correct_approach": "Le module des racines est la racine n-ième du module: 8^(1/3) = 2." }
  ],
  "source_document": { "file": "bac_2019_math_principale.pdf", "pages": "2" },
  "ocr_confidence": 0.94,
  "current_curriculum_relevance": { "status": "relevant", "score": 0.97, "validated_by_teacher": false },
  "usage_recommendation": ["use_for_current_mock_exam", "use_for_extra_practice", "use_for_concept_training"]
}
